"CODES","DESCRIPTION","YEAR","UNIT_1_CODES","UNIT_1_DESCRIPTION","UNIT_2_CODES","UNIT_2_DESCRIPTION",
84433213,"Ink-jet printers,of a kind solely used in the machines of heading 84.71",2021,01,"Number of item",09,"Kilogram",
84433214,"Thermo-printers, of a kind solely used in the machines of heading 84.71",2021,01,"Number of item",09,"Kilogram",
84433219,"Other printers,of a kind solely used in the machines of heading 84.71",2021,01,"Number of item",09,"Kilogram",
84433221,"Ink-jet digital printing machines, capable of connecting to an automatic data processing machine or to a network",2021,01,"Number of item",09,"Kilogram",
84433222,"Electrostatic photographic printing machines,capable of connecting to an automatic data processing machine or to a network",2021,01,"Number of item",09,"Kilogram",
84433229,"Other digital printing machines",2021,01,"Number of item",09,"Kilogram",
84433290,"Other printers,copying machines and facsimile machines",2021,01,"Number of item",09,"Kilogram",
84433911,"Directly process electrostatic photo-copying apparatus",2021,01,"Number of item",09,"Kilogram",
84433912,"Indirectly process electrostatic photo-copying apparatus",2021,01,"Number of item",09,"Kilogram",
84433921,"Photo-copying apparatus incorporating an optical system",2021,01,"Number of item",09,"Kilogram",
84433922,"Photo-copying apparatus of the contact type",2021,01,"Number of item",09,"Kilogram",
84433923,"Thermo-copying apparatus",2021,01,"Number of item",09,"Kilogram",
84433924,"Thermo-sublime copying apparatus",2021,01,"Number of item",09,"Kilogram",
84433931,"Ink-jet digital printing machines",2021,01,"Number of item",09,"Kilogram",
84433932,"Electrostatic photographic printing machines",2021,01,"Number of item",09,"Kilogram",
84433939,"Other digital printing machines",2021,01,"Number of item",09,"Kilogram",
84433990,"Other printers,copying machines and facsimile machines",2021,01,"Number of item",09,"Kilogram",
84439111,"Web feeder for machines under sub-heading 84.42",2021,09,"Kilogram",01,"Number of item",
84439119,"Other machines for uses ancillary to printing",2021,09,"Kilogram",01,"Number of item",
84439190,"Other parts and accessories of printing machinery of heading 84.42",2021,09,"Kilogram",01,"Number of item",
84439910,"Machines for uses ancillary to digital printing machines",2021,09,"Kilogram",01,"Number of item",
84439921,"Thermo-print heads for digital printing machines",2021,09,"Kilogram",01,"Number of item",
84439929,"Other parts and accessories for digial printing machines",2021,09,"Kilogram",?,"?",
84439990,"Other parts and accessories of heading 84.43",2021,09,"Kilogram",?,"?",
84440010,"Synthetic filament spinning jets",2021,01,"Number of item",09,"Kilogram",
84440020,"Synthetic staple fibres spinning jets",2021,01,"Number of item",09,"Kilogram",
84440030,"Artificial fibres spinning jets",2021,01,"Number of item",09,"Kilogram",
84440040,"Man-made filament crimping machinery",2021,01,"Number of item",09,"Kilogram",
84440050,"Man-made filament cutting machinery",2021,01,"Number of item",09,"Kilogram",
84440090,"Machines for extrud/draw/texture/cut man-made textile mat.nes",2021,01,"Number of item",09,"Kilogram",
84451111,"Blowing-carding machinery, for cotton type fibres",2021,01,"Number of item",09,"Kilogram",
84451112,"Bale plucker, for cotton type fibres",2021,01,"Number of item",09,"Kilogram",
84451113,"Card or carding machine, for cotton type fibres",2021,01,"Number of item",09,"Kilogram",
84451119,"Carding machines, for cotton type fibres",2021,01,"Number of item",09,"Kilogram",
84451120,"Carding machines, for wool type fibres",2021,01,"Number of item",09,"Kilogram",
84451190,"Other carding machines, nes",2021,01,"Number of item",09,"Kilogram",
84451210,"Cotton Comber",2021,01,"Number of item",09,"Kilogram",
84451220,"Worsted comber",2021,01,"Number of item",09,"Kilogram",
84451290,"Textile combing machines",2021,01,"Number of item",09,"Kilogram",
84451310,"Drawing machines",2021,01,"Number of item",09,"Kilogram",
84451321,"Cotton Roving Frames",2021,01,"Number of item",09,"Kilogram",
84451322,"Worsted Roving Machines",2021,01,"Number of item",09,"Kilogram",
84451329,"Other cotton Roving machines",2021,01,"Number of item",09,"Kilogram",
84451900,"Textile preparing machines, nes",2021,01,"Number of item",09,"Kilogram",
84452031,"Rotor Spinning Machine",2021,01,"Number of item",09,"Kilogram",
84452032,"Jet spinner",2021,01,"Number of item",09,"Kilogram",
84452039,"Other open-end spinner",2021,01,"Number of item",09,"Kilogram",
84452041,"Cotton Ring Spinning Frame",2021,01,"Number of item",09,"Kilogram",
84452042,"Worsted Ring Spinning Frame",2021,01,"Number of item",09,"Kilogram",
84452049,"Other Ring spinning frames",2021,01,"Number of item",09,"Kilogram",
84452090,"Other textile spinning machines, nes",2021,01,"Number of item",09,"Kilogram",
84453000,"Textile doubling¡ätwisting machines",2021,01,"Number of item",09,"Kilogram",
84454010,"Automatic bobbin winders",2021,01,"Number of item",09,"Kilogram",
84454090,"Other textile winding or reeling machines",2021,01,"Number of item",09,"Kilogram",
84459010,"Warping machines",2021,01,"Number of item",09,"Kilogram",
84459020,"Sizing machines",2021,01,"Number of item",09,"Kilogram",
84459090,"Other machines for producing¡äpreparing textile yarn, nes",2021,01,"Number of item",09,"Kilogram",
84461000,"Machines for weaving fabrics of a width ¡Ü30 cm",2021,01,"Number of item",09,"Kilogram",
84462110,"Power looms for weaving carpets/rugs of width¡µ30cm,shuttle type",2021,01,"Number of item",09,"Kilogram",
84462190,"Power looms for weaving fabrics of width¡µ30 cm, nes,shuttle type",2021,01,"Number of item",09,"Kilogram",
84462900,"Machines for weaving fabrics of a width ¡µ30 cm shuttle type nes",2021,01,"Number of item",09,"Kilogram",
84463020,"Rapier looms for weaving fabrics of a width¡µ30cm, shuttless",2021,01,"Number of item",09,"Kilogram",
84463030,"Carrier looms for weaving fabrics of a width¡µ30cm, shuttless",2021,01,"Number of item",09,"Kilogram",
84463040,"Water jet looms for weaving fabrics of a width¡µ30cm, shuttless",2021,01,"Number of item",09,"Kilogram",
84463050,"Air jet looms for weaving fabrics of a width¡µ30cm, shuttless",2021,01,"Number of item",09,"Kilogram",
84463090,"Machines for weaving fabrics of a width¡µ30cm, shuttleless nes",2021,01,"Number of item",09,"Kilogram",
84471100,"Circular knitting machines with cylinder diameter¡Ü165 mm",2021,01,"Number of item",09,"Kilogram",
84471200,"Circular knitting machines with cylinder diameter¡µ165 mm",2021,01,"Number of item",09,"Kilogram",
84472011,"Tricot warp knitting machines",2021,01,"Number of item",09,"Kilogram",
84472012,"Raschel warp knitting machines",2021,01,"Number of item",09,"Kilogram",
84472019,"Other warp knitting machines",2021,01,"Number of item",09,"Kilogram",
84472020,"Flat weftknitting machines",2021,01,"Number of item",09,"Kilogram",
84472030,"Stitch-bonding machines",2021,01,"Number of item",09,"Kilogram",
84479011,"Tufting machines for making carpets or rugs",2021,01,"Number of item",09,"Kilogram",
84479019,"Other tufting machines",2021,01,"Number of item",09,"Kilogram",
84479020,"Embroidery machines",2021,01,"Number of item",09,"Kilogram",
84479090,"Machines for making gimped yarn/tulle/lace/trimmings/braid/net",2021,01,"Number of item",09,"Kilogram",
84481100,"Dobbies,Jacquards,card reducing,for machines of 84.44,45,46,47",2021,09,"Kilogram",?,"?",
84481900,"Auxiliary machy nes for machins of 84.44,84.45,84.46,84.47",2021,09,"Kilogram",?,"?",
84482020,"Extruding nipples or spinnerets",2021,01,"Number of item",09,"Kilogram",
84482090,"Pts/accessories of mach of 84.44/thr auxiliary machy, nes",2021,09,"Kilogram",?,"?",
84483100,"Card clothing for hdg No 84.45",2021,09,"Kilogram",?,"?",
84483200,"Parts/accessories of machns for prep textile fibres, nes",2021,09,"Kilogram",?,"?",
84483310,"Wirding unit for automatic winder",2021,01,"Number of item",09,"Kilogram",
84483390,"Spindles,spindle flyers,spinning rings and ring travellers",2021,09,"Kilogram",?,"?",
84483910,"Open-end rotors of mach of 84.45¡äof their auxiliary machines",2021,01,"Number of item",09,"Kilogram",
84483920,"Electronic cleaner for automatic wnder",2021,01,"Number of item",09,"Kilogram",
84483930,"Air splicer for automatic winder",2021,01,"Number of item",09,"Kilogram",
84483940,"Close spinning device of ring spinning frames",2021,01,"Number of item",09,"Kilogram",
84483990,"Parts/accessories of machines of 84.45/thr auxiliary machines, nes",2021,09,"Kilogram",?,"?",
84484200,"Reeds for looms, healds & heald-frames for weaving machines (looms)",2021,09,"Kilogram",?,"?",
84484910,"Picking and receiving unit for projective weaving machine",2021,01,"Number of item",09,"Kilogram",
84484920,"Weft insertion and left-off motion for air-je loom",2021,01,"Number of item",09,"Kilogram",
84484930,"Shuttles for weaving machines (looms)",2021,01,"Number of item",09,"Kilogram",
84484990,"Parts & accessories of weaving mches¡äof their auxiliary mach nes",2021,09,"Kilogram",?,"?",
84485120,"Beard needles, crotchet hooks for knitting machines, gauge No.£¼28",2021,09,"Kilogram",?,"?",
84485190,"Sinkers, needles/oth articles used in form stitches",2021,09,"Kilogram",?,"?",
84485900,"Other parts/accessories of machns of 84.47/their auxiliary machinery",2021,09,"Kilogram",?,"?",
84490010,"Machinery for stitich",2021,01,"Number of item",09,"Kilogram",
84490020,"Spunlaced equiqment",2021,01,"Number of item",09,"Kilogram",
84490090,"Other machinery for working felt/nonwovens (incl. felt hats)",2021,09,"Kilogram",?,"?",
84501110,"Full-auto machines of the continuously rotating impeller, dry linen wt.¡Ü10 kg",2021,01,"Number of item",09,"Kilogram",
84501120,"Full-auto machines of the drum type, dry linen wt.¡Ü10 kg",2021,01,"Number of item",09,"Kilogram",
84501190,"Full-automatic washing machines, of a dry linen capacity ¡Ü10 kg",2021,01,"Number of item",09,"Kilogram",
84501200,"Other washing mach, dry linen capacity¡Ü10kg, with built-in dryer",2021,01,"Number of item",09,"Kilogram",
84501900,"Other washing machines of a dry linen capacity¡Ü10kg, nes",2021,01,"Number of item",09,"Kilogram",
84502011,"Full-automatic washing maching of the continuously rotating impeller,dry linen wt.£¾10 kg",2021,01,"Number of item",09,"Kilogram",
84502012,"Full-automatic washing maching of the drum type,dry linen wt.£¾10 kg",2021,01,"Number of item",09,"Kilogram",
84502019,"Other full-automatic washing maching,dry linen wt.£¾10 kg",2021,01,"Number of item",09,"Kilogram",
84502090,"Non-automatic washing maching,dry linen wt.£¾10 kg",2021,01,"Number of item",09,"Kilogram",
84509010,"Parts of washing machines, dry linen capacity¡Ü10kg",2021,09,"Kilogram",?,"?",
84509090,"Parts of washing machines, dry linen capacity£¾10kg",2021,09,"Kilogram",?,"?",
84511000,"Dry-cleaning machines o/t hdg No 84.50",2021,01,"Number of item",09,"Kilogram",
84512100,"Drying machines (o/t hdg No 84.50) each of a dry linen cap¡Ü10 kg",2021,01,"Number of item",09,"Kilogram",
84512900,"Drying machines (o/t No 84.50) nes",2021,01,"Number of item",09,"Kilogram",
84513000,"Ironing machines & presses (including fusing presses)",2021,01,"Number of item",09,"Kilogram",
84514000,"Washing, bleaching¡ädyeing machines",2021,01,"Number of item",09,"Kilogram",
84515000,"Machines for reeling,unreeling,folding,cut¡äpink textile fabrics",2021,01,"Number of item",09,"Kilogram",
84518000,"Machines for wring/dress/finishing/coating¡äimpreg tex yarns etc",2021,01,"Number of item",09,"Kilogram",
84519000,"Parts of machinery of heading No. 84.51",2021,09,"Kilogram",?,"?",
84521010,"Multifunctional household type sewing machines",2021,01,"Number of item",09,"Kilogram",
84521091,"Hand-operated sewing machines of household type",2021,01,"Number of item",09,"Kilogram",
84521099,"Other sewing machines of household type",2021,01,"Number of item",09,"Kilogram",
84522110,"Non-household type automatic sewing machines, flatseam",2021,01,"Number of item",09,"Kilogram",
84522120,"Non-household type automatic overlock machine",2021,01,"Number of item",09,"Kilogram",
84522130,"Non-household type automatic interlock machine",2021,01,"Number of item",09,"Kilogram",
84522190,"Other non-household type automatic sewing machines nes",2021,01,"Number of item",09,"Kilogram",
84522900,"Sewing machines, other than book-sewing machines, nes",2021,01,"Number of item",09,"Kilogram",
84523000,"Sewing machine needles",2021,09,"Kilogram",?,"?",
84529011,"Rotating shuttles of household sewing machines",2021,09,"Kilogram",?,"?",
84529019,"Parts of household sewing machines, nes",2021,09,"Kilogram",?,"?",
84529091,"Rotating shuttles of non-household sewing machines",2021,09,"Kilogram",?,"?",
84529092,"Furniture/bases/covers and parts thereof for non-household sewing machines",2021,09,"Kilogram",?,"?",
84529099,"Parts of non-household sewing machines, nes",2021,09,"Kilogram",?,"?",
84531000,"Machinery for preparing,tanning¡äworking hides, skins¡äleather",2021,01,"Number of item",09,"Kilogram",
84532000,"Machinery for making¡ärepairing footwear",2021,01,"Number of item",09,"Kilogram",
84538000,"Mach for making¡ärepair art of hides,skins¡äleather nes",2021,01,"Number of item",09,"Kilogram",
84539000,"Parts of machinery of heading No. 84.53",2021,09,"Kilogram",?,"?",
84541000,"Converters used in metallurgy¡ämetal foundries",2021,01,"Number of item",09,"Kilogram",
84542010,"Out furnace refining equipment",2021,01,"Number of item",09,"Kilogram",
84542090,"Ingot moulds & ladles used in metallurgy¡ämetal foundries, nes",2021,01,"Number of item",09,"Kilogram",
84543010,"Cold chamber die-casting machines",2021,01,"Number of item",09,"Kilogram",
84543021,"Ingot block continuous casting machines",2021,01,"Number of item",09,"Kilogram",
84543022,"Ingot slab continuous casting machines",2021,01,"Number of item",09,"Kilogram",
84543029,"Other ingot continuous casting machines nes",2021,01,"Number of item",09,"Kilogram",
84543090,"Casting machines used in metallurgy¡ämetal foundries, nes",2021,01,"Number of item",09,"Kilogram",
84549010,"Parts of out furnace refining equipment",2021,09,"Kilogram",?,"?",
84549021,"Crystallizers for ingot continuous casting machines",2021,09,"Kilogram",?,"?",
84549022,"Vibrating devices for ingot continuous casting machines",2021,09,"Kilogram",?,"?",
84549029,"Other parts for ingot continuous casting machines",2021,09,"Kilogram",?,"?",
84549090,"Parts of other machines of heading No. 84.54",2021,09,"Kilogram",?,"?",
84551010,"Hot-rolling tube mills",2021,01,"Number of item",09,"Kilogram",
84551020,"Cold-rolling tube mills",2021,01,"Number of item",09,"Kilogram",
84551030,"Tube rolling mill with capacity to rix-reduce diameter",2021,01,"Number of item",09,"Kilogram",
84551090,"Metal rolling tube mills, nes",2021,01,"Number of item",09,"Kilogram",
84552110,"Hot-rolling flat mills",2021,01,"Number of item",09,"Kilogram",
84552120,"Rolling mills for shapes and sections",2021,01,"Number of item",09,"Kilogram",
84552130,"Rolling mills for bars and rods in coils",2021,01,"Number of item",09,"Kilogram",
84552190,"Hot or combination hot and cold metal rolling mills, nes",2021,01,"Number of item",09,"Kilogram",
84552210,"Cold-rolling flat mills",2021,01,"Number of item",09,"Kilogram",
84552290,"Cold metal rolling mills, nes",2021,01,"Number of item",09,"Kilogram",
84553000,"Rolls for metal rolling mills",2021,01,"Number of item",09,"Kilogram",
84559000,"Parts of metal rolling mills & rolls",2021,09,"Kilogram",?,"?",
84561100,"Machine-tools operatd by laser process",2021,01,"Number of item",09,"Kilogram",
84561200,"Machine-tools operatd by other light or photon beam processes",2021,01,"Number of item",09,"Kilogram",
84562000,"Machine-tools operatd by ultrasonic processes",2021,01,"Number of item",09,"Kilogram",
84563010,"Machine-tools operatd by electro-discharge processe, numerically contrlld",2021,01,"Number of item",09,"Kilogram",
84563090,"Machine-tools operatd by electro-discharge procsse, not numericly contrld",2021,01,"Number of item",09,"Kilogram",
84564010,"Cutting machines of plasma arc",2021,01,"Number of item",09,"Kilogram",
84564090,"Other machine-tools operatd by plasma arc process",2021,01,"Number of item",09,"Kilogram",
84565000,"Water-jet cutting machines",2021,01,"Number of item",09,"Kilogram",
84569000,"Machine-tools operatd by electro-chemical, electron beam or ionic-beam process",2021,01,"Number of item",09,"Kilogram",
84571010,"Vertical machining centres",2021,01,"Number of item",09,"Kilogram",
84571020,"Horizontal machining centres",2021,01,"Number of item",09,"Kilogram",
84571030,"Plano machining centres",2021,01,"Number of item",09,"Kilogram",
84571091,"Mill-Turn machining centres",2021,01,"Number of item",09,"Kilogram",
84571099,"Machining centres,nes",2021,01,"Number of item",09,"Kilogram",
84572000,"Unit construction machines (single station)",2021,01,"Number of item",09,"Kilogram",
84573000,"Multi-station transfer machines",2021,01,"Number of item",09,"Kilogram",
84581100,"Horizontal lathes numerically controlled",2021,01,"Number of item",09,"Kilogram",
84581900,"Horizontal lathes nes",2021,01,"Number of item",09,"Kilogram",
84589110,"Vertical lathes numerically controlled",2021,01,"Number of item",09,"Kilogram",
84589120,"Lathes nes numerically controlled",2021,01,"Number of item",09,"Kilogram",
84589900,"Lathes nes for removing metal",2021,01,"Number of item",09,"Kilogram",
84591000,"Way-type unit head machines",2021,01,"Number of item",09,"Kilogram",
84592100,"Drilling machines nes, numerically controlled",2021,01,"Number of item",09,"Kilogram",
84592900,"Drilling machines nes, for removing metal",2021,01,"Number of item",09,"Kilogram",
84593100,"Boring-milling machines nes, numerically controlled",2021,01,"Number of item",09,"Kilogram",
84593900,"Boring-milling machines nes for removing metal",2021,01,"Number of item",09,"Kilogram",
84594100,"Boring machines, numerically controlled",2021,01,"Number of item",09,"Kilogram",
84594900,"Other boring machines",2021,01,"Number of item",09,"Kilogram",
84595100,"Milling mach, knee-type numerically controlled",2021,01,"Number of item",09,"Kilogram",
84595900,"Milling mach, knee-type nes for removing metal",2021,01,"Number of item",09,"Kilogram",
84596110,"Planomilling machines , numerically controlled",2021,01,"Number of item",09,"Kilogram",
84596190,"Milling machines nes, numerically controlled",2021,01,"Number of item",09,"Kilogram",
84596910,"Planoilling machines, not numerically controlled",2021,01,"Number of item",09,"Kilogram",
84596990,"Milling machines nes, not numerically controlled",2021,01,"Number of item",09,"Kilogram",
84597000,"Threading¡ätapping machines nes for removing metal",2021,01,"Number of item",09,"Kilogram",
84601210,"Flat-surface grinding machines, numerically controled, accuracy at least 0.01mm",2021,01,"Number of item",09,"Kilogram",
84601290,"Other flat-surface grinding machines, numerically controled",2021,01,"Number of item",09,"Kilogram",
84601910,"Other flat-surface grinding machines, accuracy at least 0.01mm",2021,01,"Number of item",09,"Kilogram",
84601990,"Flat-surface grinding machines, nes",2021,01,"Number of item",09,"Kilogram",
84602210,"Centreless grinding machines, numerically controlled, accuracy at least 0.01mm",2021,01,"Number of item",09,"Kilogram",
84602290,"Other centreless grinding machines, numerically controled",2021,01,"Number of item",09,"Kilogram",
84602311,"Crank shaft grinding machines, numerically controlled, accuracy at least 0.01mm",2021,01,"Number of item",09,"Kilogram",
84602319,"Other cylindrical grinding machines, numerically controlled, accuracy at least 0.01mm",2021,01,"Number of item",09,"Kilogram",
84602390,"Other cylindrical grinding machines, numerically controled",2021,01,"Number of item",09,"Kilogram",
84602411,"Internal grinding machines, numerically controlled, accuracy at least 0.01mm",2021,01,"Number of item",09,"Kilogram",
84602419,"Other grinding machines, numerically controlled, accuracy at least 0.01mm",2021,01,"Number of item",09,"Kilogram",
84602490,"Other grinding machines, numerically controlled",2021,01,"Number of item",09,"Kilogram",
84602911,"Other cylindrical grinding machines, accuracy at least 0.01mm",2021,01,"Number of item",09,"Kilogram",
84602912,"Other internal grinding machines, accuracy at least 0.01mm",2021,01,"Number of item",09,"Kilogram",
84602913,"Other grinding machines of roll, accuracy at least 0.01mm",2021,01,"Number of item",09,"Kilogram",
84602919,"Other grinding machines, nes, accuracy at least 0.01mm",2021,01,"Number of item",09,"Kilogram",
84602990,"Other grinding machines, nes",2021,01,"Number of item",09,"Kilogram",
84603100,"Sharpening (tool/cutter grinding) machines, numerically controlled",2021,01,"Number of item",09,"Kilogram",
84603900,"Sharpening (tool¡äcutter grinding) machines, not numericl contrld",2021,01,"Number of item",09,"Kilogram",
84604010,"Honing machines",2021,01,"Number of item",09,"Kilogram",
84604020,"Lapping machines",2021,01,"Number of item",09,"Kilogram",
84609010,"Grinding wheel mechines",2021,01,"Number of item",09,"Kilogram",
84609020,"Polishing machines",2021,01,"Number of item",09,"Kilogram",
84609090,"Mach-tools for finishing metals with polishng prod, nes",2021,01,"Number of item",09,"Kilogram",
84612010,"Shaping machines",2021,01,"Number of item",09,"Kilogram",
84612020,"Slotting machines",2021,01,"Number of item",09,"Kilogram",
84613000,"Broaching machines",2021,01,"Number of item",09,"Kilogram",
84614011,"Gear grinding machines,numerically-controlled",2021,01,"Number of item",09,"Kilogram",
84614019,"Gear cutting/fishing machines,numerciallly-controlled",2021,01,"Number of item",09,"Kilogram",
84614090,"Gear cutting/grinding/finishing machns, not numerical contrld",2021,01,"Number of item",09,"Kilogram",
84615000,"Sawing¡äcutting-off machines by removing metal",2021,01,"Number of item",09,"Kilogram",
84619011,"Double-column (open-side) planing machines",2021,01,"Number of item",09,"Kilogram",
84619019,"Other planing machines, nes",2021,01,"Number of item",09,"Kilogram",
84619090,"Other machines-tools working by removing metal, nes",2021,01,"Number of item",09,"Kilogram",
84621010,"Forging¡ädie-stamping mach & hammers,numerically controlled",2021,01,"Number of item",09,"Kilogram",
84621090,"Forging¡ädie-stamping mach & hammers, not numerically contrld",2021,01,"Number of item",09,"Kilogram",
84622110,"Straightenning machines, numericly contrld",2021,01,"Number of item",09,"Kilogram",
84622190,"Bending, folding or flattening machines, numericly contrld",2021,01,"Number of item",09,"Kilogram",
84622910,"Straightenning machines, not numerically controlled",2021,01,"Number of item",09,"Kilogram",
84622990,"Bending, folding or flattening machines, not numricl contrld",2021,01,"Number of item",09,"Kilogram",
84623110,"Lengthwise shearing machine, numerically controlld",2021,01,"Number of item",09,"Kilogram",
84623120,"Transverse shearing machine, numerically controlld",2021,01,"Number of item",09,"Kilogram",
84623190,"Other shearing machine, numerically controlld",2021,01,"Number of item",09,"Kilogram",
84623910,"Lengthwise shearing machine, not numrically controlled",2021,01,"Number of item",09,"Kilogram",
84623920,"Transverse shearing machine, not numrically controlled",2021,01,"Number of item",09,"Kilogram",
84623990,"Other shearing machine, not numrically controlled",2021,01,"Number of item",09,"Kilogram",
84624111,"CNC automatic tool change punch press",2021,01,"Number of item",09,"Kilogram",
84624119,"Other punch press, nes",2021,01,"Number of item",09,"Kilogram",
84624190,"Punching/notching machines, numerically controlled",2021,01,"Number of item",09,"Kilogram",
84624900,"Punching/notching machines, not numerically controlled",2021,01,"Number of item",09,"Kilogram",
84629110,"Metal section squeezing machine, hydraulic",2021,01,"Number of item",09,"Kilogram",
84629190,"Hydraulic presses nes",2021,01,"Number of item",09,"Kilogram",
84629910,"Mechanical presses",2021,01,"Number of item",09,"Kilogram",
84629990,"Presses nes for working metal",2021,01,"Number of item",09,"Kilogram",
84631011,"Cold-drawing tube benches, drawing force¡Ü300t",2021,01,"Number of item",09,"Kilogram",
84631019,"Cold-drawing tube benches, drawing force£¾300t",2021,01,"Number of item",09,"Kilogram",
84631020,"Wiredrawing machines",2021,01,"Number of item",09,"Kilogram",
84631090,"Other draw-benches for bars/tubes/profiles/wire, nes",2021,01,"Number of item",09,"Kilogram",
84632000,"Thread rolling machines",2021,01,"Number of item",09,"Kilogram",
84633000,"Machines for working metal wire",2021,01,"Number of item",09,"Kilogram",
84639000,"Machine-tools for workg metals without removing material, nes",2021,01,"Number of item",09,"Kilogram",
84641010,"Sawing machine of disk saw",2021,01,"Number of item",09,"Kilogram",
84641020,"Sawing machine of scroll saw",2021,01,"Number of item",09,"Kilogram",
84641090,"Other sawing machine, nes",2021,01,"Number of item",09,"Kilogram",
84642010,"Grindg/polish mach for grinding or polishing glass or glassware",2021,01,"Number of item",09,"Kilogram",
84642090,"Other grinding or polishing machines, nes",2021,01,"Number of item",09,"Kilogram",
84649011,"Cutting-off machines for cold-working glass or glassware",2021,01,"Number of item",09,"Kilogram",
84649012,"Carving machines for cold-working glass or glassware",2021,01,"Number of item",09,"Kilogram",
84649019,"Other machines for cold-working glass or glassware, nes",2021,01,"Number of item",09,"Kilogram",
84649090,"Other machine-tools for working stone, ceramics, concrete, nes",2021,01,"Number of item",09,"Kilogram",
84651000,"Machines which can carry out different types of machining operations without tool change",2021,01,"Number of item",09,"Kilogram",
