"CODES","DESCRIPTION","YEAR","UNIT_1_CODES","UNIT_1_DESCRIPTION","UNIT_2_CODES","UNIT_2_DESCRIPTION",
61159400,"Hosiery & footwear, of wool or fine animal hair, knitted or crocheted, nes",2021,02,"Pair",09,"Kilogram",
61159500,"Hosiery & footwear, of cotton, knitted or crocheted, nes",2021,02,"Pair",09,"Kilogram",
61159600,"Hosiery & footwear, of synthetic fibres, knitted or crocheted, nes",2021,02,"Pair",09,"Kilogram",
61159900,"Hosiery & footwear, of other textiles, knitted or crocheted, nes",2021,02,"Pair",09,"Kilogram",
61161000,"Gloves, impregnated... with plastics or rubber, knitted or crocheted",2021,02,"Pair",09,"Kilogram",
61169100,"Gloves, mittens & mitts, of wool..., knitted or crocheted",2021,02,"Pair",09,"Kilogram",
61169200,"Gloves, mittens & mitts, of cotton, knitted or crocheted",2021,02,"Pair",09,"Kilogram",
61169300,"Gloves, mittens & mitts, of synthetic fibres, knitted or crocheted",2021,02,"Pair",09,"Kilogram",
61169900,"Gloves, mittens & mitts, of other textiles, knitted or crocheted",2021,02,"Pair",09,"Kilogram",
61171011,"Shawls, scarves, mufflers, mantillas, veils and the like,knitted/crocheted,of cashmere",2021,01,"Number of item",09,"Kilogram",
61171019,"Shawls, scarves, mufflers, mantillas, veils and the like,knitted/crocheted,of fine animal hair(excl.cashmere)",2021,01,"Number of item",09,"Kilogram",
61171020,"Shawls, scarves, mufflers, mantillas, veils and the like,knitted/crocheted,of wool",2021,01,"Number of item",09,"Kilogram",
61171090,"Other shawls, scarves, mufflers, mantillas, veils and the like,knitted/crocheted",2021,01,"Number of item",09,"Kilogram",
61178010,"Ties, bow ties & cravats, knitted or crocheted",2021,09,"Kilogram",01,"Number of item",
61178090,"Other clothing accessories, knitted or crocheted, nes",2021,09,"Kilogram",?,"?",
61179000,"Parts of garments or clothing accessories, knitted or crocheted",2021,09,"Kilogram",?,"?",
62011100,"Men's or boys' overcoats, etc, of wool or fine animal hair",2021,01,"Number of item",09,"Kilogram",
62011210,"Men's or boys' overcoats, etc, of cotton, stuffed with down",2021,01,"Number of item",09,"Kilogram",
62011290,"Men's or boys' overcoats, etc, of cotton, nes",2021,01,"Number of item",09,"Kilogram",
62011310,"Men's or boys' overcoats, etc, of man-made fibres, down stuffed",2021,01,"Number of item",09,"Kilogram",
62011390,"Men's or boys' overcoats, etc, of man-made fibres, nes",2021,01,"Number of item",09,"Kilogram",
62011900,"Men's or boys' overcoats, etc, of other textiles, nes",2021,01,"Number of item",09,"Kilogram",
62019100,"Men's or boys' anoraks, wind-cheaters, etc, of wool/fine animal hair",2021,01,"Number of item",09,"Kilogram",
62019210,"Men's or boys' anoraks, wind-cheaters, etc, of cotton, down stuffed",2021,01,"Number of item",09,"Kilogram",
62019290,"Men's or boys' anoraks, wind-cheaters, etc, of cotton, nes",2021,01,"Number of item",09,"Kilogram",
62019310,"Men's/boys' anoraks, wind-cheaters.., of man-made fib, down stuffed",2021,01,"Number of item",09,"Kilogram",
62019390,"Men's or boys' anoraks, wind-cheaters, etc, of man-made fibres, nes",2021,01,"Number of item",09,"Kilogram",
62019900,"Men's or boys' anoraks, wind-cheaters, etc, of other textiles, nes",2021,01,"Number of item",09,"Kilogram",
62021100,"Woman's or girls' overcoats, etc, of wool or fine animal hair",2021,01,"Number of item",09,"Kilogram",
62021210,"Woman's or girls' overcoats, etc, of cotton, stuffed with down",2021,01,"Number of item",09,"Kilogram",
62021290,"Woman's or girls' overcoats, etc, of cotton, nes",2021,01,"Number of item",09,"Kilogram",
62021310,"Woman's or girls' overcoats, etc, of man-made fibres, down stuffed",2021,01,"Number of item",09,"Kilogram",
62021390,"Woman's or girls' overcoats, etc, of man-made fibres, nes",2021,01,"Number of item",09,"Kilogram",
62021900,"Woman's or girls' overcoats, etc, of other textiles, nes",2021,01,"Number of item",09,"Kilogram",
62029100,"Woman's or girls' anoraks, wind-cheaters, etc, of wool...",2021,01,"Number of item",09,"Kilogram",
62029210,"Woman's or girls' anoraks, wind-cheaters.., of cotton, down stuffd",2021,01,"Number of item",09,"Kilogram",
62029290,"Woman's or girls' anoraks, wind-cheaters.., of cotton, nes",2021,01,"Number of item",09,"Kilogram",
62029310,"Woman's/girls' anoraks,wind-cheaters.., of man-made fib, down stuffd",2021,01,"Number of item",09,"Kilogram",
62029390,"Woman's or girls' anoraks, wind-cheaters.., of man-made fibres, nes",2021,01,"Number of item",09,"Kilogram",
62029900,"Woman's or girls' anoraks, wind-cheaters, etc, of other textiles, nes",2021,01,"Number of item",09,"Kilogram",
62031100,"Men's or boys' suits of wool or fine animal hair",2021,01,"Number of item",09,"Kilogram",
62031200,"Men's or boys' suits of synthetic fibres",2021,01,"Number of item",09,"Kilogram",
62031910,"Men's or boys' suits of silk or silk waste",2021,01,"Number of item",09,"Kilogram",
62031990,"Men's or boys' suits of other textiles, nes",2021,01,"Number of item",09,"Kilogram",
62032200,"Men's or boys' ensembles of cotton",2021,01,"Number of item",09,"Kilogram",
62032300,"Men's or boys' ensembles of synthetic fibres",2021,01,"Number of item",09,"Kilogram",
62032910,"Men's or boys' ensembles of silk or silk waste",2021,01,"Number of item",09,"Kilogram",
62032920,"Men's or boys' ensembles of wool or fine animal hair",2021,01,"Number of item",09,"Kilogram",
62032990,"Men's or boys' ensembles of other textiles, nes",2021,01,"Number of item",09,"Kilogram",
62033100,"Men's or boys' jackets & blazers of wool or fine animal hair",2021,01,"Number of item",09,"Kilogram",
62033200,"Men's or boys' jackets & blazers of cotton",2021,01,"Number of item",09,"Kilogram",
62033300,"Men's or boys' jackets & blazers of synthetic fibres",2021,01,"Number of item",09,"Kilogram",
62033910,"Men's or boys' jackets & blazers of silk or silk waste",2021,01,"Number of item",09,"Kilogram",
62033990,"Men's or boys' jackets & blazers of other textl materials, nes",2021,01,"Number of item",09,"Kilogram",
62034100,"Men's or boys' trousers, breeches, etc, of wool or fine animal hair",2021,01,"Number of item",09,"Kilogram",
62034210,"Men's or boys' arabian trousers, breeches of cotton",2021,01,"Number of item",09,"Kilogram",
62034290,"Men's or boys' trousers, breeches, nes, of cotton",2021,01,"Number of item",09,"Kilogram",
62034310,"Men's or boys' arabian trousers, breeches of synthetic fibres",2021,01,"Number of item",09,"Kilogram",
62034390,"Men's or boys' trousers, breeches, nes, of synthetic fibres",2021,01,"Number of item",09,"Kilogram",
62034910,"Men's or boys' arabian trousers, breeches of oth textile fibres",2021,01,"Number of item",09,"Kilogram",
62034990,"Men's or boys' trousers, breeches, nes, of oth textile fibres",2021,01,"Number of item",09,"Kilogram",
62041100,"Women's or girls' suits of wool or fine animal hair",2021,01,"Number of item",09,"Kilogram",
62041200,"Women's or girls' suits of cotton",2021,01,"Number of item",09,"Kilogram",
62041300,"Women's or girls' suits of synthetic fibres",2021,01,"Number of item",09,"Kilogram",
62041910,"Women's or girls' suits of silk or silk waste",2021,01,"Number of item",09,"Kilogram",
62041990,"Women's or girls' suits of other textiles, nes",2021,01,"Number of item",09,"Kilogram",
62042100,"Women's or girls' ensembles of wool or fine animal hair",2021,01,"Number of item",09,"Kilogram",
62042200,"Women's or girls' ensembles of cotton",2021,01,"Number of item",09,"Kilogram",
62042300,"Women's or girls' ensembles of synthetic fibres",2021,01,"Number of item",09,"Kilogram",
62042910,"Women's or girls' ensembles of silk or silk waste",2021,01,"Number of item",09,"Kilogram",
62042990,"Women's or girls' ensembles of other textile materials, nes",2021,01,"Number of item",09,"Kilogram",
62043100,"Women's or girls' jackets & blazers of wool or fine animal hair",2021,01,"Number of item",09,"Kilogram",
62043200,"Women's or girls' jackets & blazers of cotton",2021,01,"Number of item",09,"Kilogram",
62043300,"Women's or girls' jackets & blazers of synthetic fibres",2021,01,"Number of item",09,"Kilogram",
62043910,"Women's or girls' jackets of silk or silk waste",2021,01,"Number of item",09,"Kilogram",
62043990,"Women's or girls' jackets of other textiles, nes",2021,01,"Number of item",09,"Kilogram",
62044100,"Dresses of wool or fine animal hair",2021,01,"Number of item",09,"Kilogram",
62044200,"Dresses of cotton",2021,01,"Number of item",09,"Kilogram",
62044300,"Dresses of synthetic fibres",2021,01,"Number of item",09,"Kilogram",
62044400,"Dresses of artificial fibres",2021,01,"Number of item",09,"Kilogram",
62044910,"Women's or girls' dresses of silk or silk waste",2021,01,"Number of item",09,"Kilogram",
62044990,"Women's or girls' dresses of other textile materials, nes",2021,01,"Number of item",09,"Kilogram",
62045100,"Skirts & divided skirts of wool or fine animal hair",2021,01,"Number of item",09,"Kilogram",
62045200,"Skirts & divided skirts of cotton",2021,01,"Number of item",09,"Kilogram",
62045300,"Skirts & divided skirts of synthetic fibres",2021,01,"Number of item",09,"Kilogram",
62045910,"Women's or girls' skirts of silk or silk waste",2021,01,"Number of item",09,"Kilogram",
62045990,"Women's or girls' skirts of other textile materials, nes",2021,01,"Number of item",09,"Kilogram",
62046100,"Women's or girls' trousers/breeches, etc, of wool/fine animal hair",2021,01,"Number of item",09,"Kilogram",
62046200,"Women's or girls' trousers, breeches, etc, of cotton",2021,01,"Number of item",09,"Kilogram",
62046300,"Women's or girls' trousers, breeches, etc, of synthetic fibres",2021,01,"Number of item",09,"Kilogram",
62046900,"Women's or girls' trousers, breeches, etc, of other textiles, nes",2021,01,"Number of item",09,"Kilogram",
62052000,"Men's or boys' shirts of cotton",2021,01,"Number of item",09,"Kilogram",
62053000,"Men's or boys' shirts of man-made fibres",2021,01,"Number of item",09,"Kilogram",
62059010,"Men's or boys' shirts of silk or silk waste",2021,01,"Number of item",09,"Kilogram",
62059020,"Men's or boys' shirts of wool or fine animal hair",2021,01,"Number of item",09,"Kilogram",
62059090,"Men's or boys' shirts of other textile materials, nes",2021,01,"Number of item",09,"Kilogram",
62061000,"Women's or girls' blouses, shirts, etc, of silk or silk waste",2021,01,"Number of item",09,"Kilogram",
62062000,"Women's or girls' blouses, shirts, etc, of wool or fine animal hair",2021,01,"Number of item",09,"Kilogram",
62063000,"Women's or girls' blouses, shirts, etc, of cotton",2021,01,"Number of item",09,"Kilogram",
62064000,"Women's or girls' blouses, shirts, etc, of man-made fibres",2021,01,"Number of item",09,"Kilogram",
62069000,"Women's or girls' blouses, shirts, etc, of other textiles, nes",2021,01,"Number of item",09,"Kilogram",
62071100,"Men's or boys' underpants & briefs of cotton",2021,01,"Number of item",09,"Kilogram",
62071910,"Men's or boys' underpants & briefs of silk or silk waste",2021,01,"Number of item",09,"Kilogram",
62071920,"Men's or boys' underpants & briefs of man-made fibres",2021,01,"Number of item",09,"Kilogram",
62071990,"Men's or boys' underpants & briefs of oth textile materials, nes",2021,01,"Number of item",09,"Kilogram",
62072100,"Men's or boys' nightshirts & pyjamas of cotton",2021,01,"Number of item",09,"Kilogram",
62072200,"Men's or boys' nightshirts & pyjamas of man-made fibres",2021,01,"Number of item",09,"Kilogram",
62072910,"Men's or boys' nightshirts & pyjamas of silk or silk waste",2021,01,"Number of item",09,"Kilogram",
62072990,"Men's or boys' nightshirts & pyjamas of oth textl materials, nes",2021,01,"Number of item",09,"Kilogram",
62079100,"Men's or boys' singlets, dressing gowns, etc, of cotton",2021,01,"Number of item",09,"Kilogram",
62079910,"Men's or boys' singlets,dressing gowns, etc, of silk or silk waste",2021,01,"Number of item",09,"Kilogram",
62079920,"Men's or boys' singlets,dressing gowns, etc, of man-made fibres",2021,01,"Number of item",09,"Kilogram",
62079990,"Men's/boys'singlets,dressing gowns etc, of other textl materials, nes",2021,01,"Number of item",09,"Kilogram",
62081100,"Women's or girls' slips & petticoats of man-made fibres",2021,01,"Number of item",09,"Kilogram",
62081910,"Women's or girls' slips & petticoats of silk or silk waste",2021,01,"Number of item",09,"Kilogram",
62081920,"Women's or girls' slips & petticoats of cotton",2021,01,"Number of item",09,"Kilogram",
62081990,"Women's or girls' slips & petticoats of oth textl materials, nes",2021,01,"Number of item",09,"Kilogram",
62082100,"Women's or girls' nightdresses & pyjamas of cotton",2021,01,"Number of item",09,"Kilogram",
62082200,"Women's or girls' nightdresses & pyjamas of man-made fibres",2021,01,"Number of item",09,"Kilogram",
62082910,"Women's or girls' nightdresses & pyjamas of silk or silk waste",2021,01,"Number of item",09,"Kilogram",
62082990,"Women's or girls' nightdresses & pyjamas of oth textl materls, nes",2021,01,"Number of item",09,"Kilogram",
62089100,"Women's or girls' dressing gowns, panties, etc, of cotton",2021,01,"Number of item",09,"Kilogram",
62089200,"Women's or girls' dressing gowns, panties, etc, of man-made fibres",2021,01,"Number of item",09,"Kilogram",
62089910,"Women's or girls' dressing gowns, panties.., of silk or silk waste",2021,01,"Number of item",09,"Kilogram",
62089990,"Women's or girls' dressing gowns/panties.., of oth textiles, nes",2021,01,"Number of item",09,"Kilogram",
62092000,"Babies' garments & clothing accessories of cotton",2021,09,"Kilogram",?,"?",
62093000,"Babies' garments & clothing accessories of synthetic fibres",2021,09,"Kilogram",?,"?",
62099010,"Babies' garments & clothing accessories of wool or fine animal hair",2021,09,"Kilogram",?,"?",
62099090,"Babies' garments & clothing accessories of other textiles materials, nes",2021,09,"Kilogram",?,"?",
62101010,"Garments of felt or nonwoven, ofwool or fine animal hair",2021,01,"Number of item",09,"Kilogram",
62101020,"Garments of felt or nonwoven, of cotton or bast fibres",2021,01,"Number of item",09,"Kilogram",
62101030,"Garments of felt or nonwoven, of man-made fibres",2021,01,"Number of item",09,"Kilogram",
62101090,"Garments of felt or nonwoven, of other textiles",2021,01,"Number of item",09,"Kilogram",
62102000,"Garments of 6201.11 to 19, from fabrics of 59.03, 59.06 or 59.07",2021,01,"Number of item",09,"Kilogram",
62103000,"Garments of 6202.11 to 19, from fabrics of 59.03, 59.06 or 59.07",2021,01,"Number of item",09,"Kilogram",
62104000,"Men's or boys' garments of fabrics of 59.03, 59.06 or 59.07",2021,01,"Number of item",09,"Kilogram",
62105000,"Women's or girls' garments of fabrics of 59.03, 59.06 or 59.07",2021,01,"Number of item",09,"Kilogram",
62111100,"Men's or boys' swimwear",2021,01,"Number of item",09,"Kilogram",
62111200,"Women's or girls' swimwear",2021,01,"Number of item",09,"Kilogram",
62112010,"Ski suits, of cotton",2021,01,"Number of item",09,"Kilogram",
62112090,"Ski suits, of other textile materials",2021,01,"Number of item",09,"Kilogram",
62113210,"Men's or boys' arabian robes,of cotton",2021,01,"Number of item",09,"Kilogram",
62113220,"Men's or boys' track suits,of cotton",2021,01,"Number of item",09,"Kilogram",
62113290,"Men's or boys' garments, of cotton, nes",2021,01,"Number of item",09,"Kilogram",
62113310,"Men's or boys' arabian robes, of man-made fibres",2021,01,"Number of item",09,"Kilogram",
62113320,"Men's or boys' track suits, of man-made fibres",2021,01,"Number of item",09,"Kilogram",
62113390,"Men's or boys' garments, of man-made fibres, nes",2021,01,"Number of item",09,"Kilogram",
62113910,"Men's or boys' garments, of silk or silk waste, nes",2021,01,"Number of item",09,"Kilogram",
62113920,"Men's or boys' garments, of wool or fine animal hair, nes",2021,01,"Number of item",09,"Kilogram",
62113990,"Men's or boys' garments, of other textiles materials, nes",2021,01,"Number of item",09,"Kilogram",
62114210,"Women's or girls' track suits, of cotton, nes",2021,01,"Number of item",09,"Kilogram",
62114290,"Women's or girls' garments of cotton, nes",2021,01,"Number of item",09,"Kilogram",
62114310,"Women's or girls' track suits,of man-made fibres, nes",2021,01,"Number of item",09,"Kilogram",
62114390,"Women's or girls' garments, of man-made fibres, nes",2021,01,"Number of item",09,"Kilogram",
62114910,"Women's or girls' garments, of silk or silk waste, nes",2021,01,"Number of item",09,"Kilogram",
62114990,"Women's or girls' garments, of other textiles, nes",2021,01,"Number of item",09,"Kilogram",
62121010,"Brassieres, of man-made fibres",2021,01,"Number of item",09,"Kilogram",
62121090,"Brassieres, of other textiles",2021,01,"Number of item",09,"Kilogram",
62122010,"Girdles & panty-girdles, of man-made fibres",2021,01,"Number of item",09,"Kilogram",
62122090,"Girdles & panty-girdles, of other textiles",2021,01,"Number of item",09,"Kilogram",
62123010,"Corselettes, of man-made fibres",2021,01,"Number of item",09,"Kilogram",
62123090,"Corselettes, of other textiles",2021,01,"Number of item",09,"Kilogram",
62129010,"Braces, suspenders and the like, of man-made fibres",2021,01,"Number of item",09,"Kilogram",
62129090,"Braces, suspenders and the like, of other textiles materials, nes",2021,01,"Number of item",09,"Kilogram",
62132010,"Handkerchiefs of cotton, embroidered",2021,01,"Number of item",09,"Kilogram",
62132090,"Handkerchiefs of cotton, nes",2021,01,"Number of item",09,"Kilogram",
62139020,"Handkerchiefs of other textiles materials, embroidered",2021,01,"Number of item",09,"Kilogram",
62139090,"Handkerchiefs of other textiles materials, nes",2021,01,"Number of item",09,"Kilogram",
62141000,"Shawls, scarves, mufflers, mantillas, veils, etc, of silk/silk waste",2021,01,"Number of item",09,"Kilogram",
62142010,"Shawls, scarves, mufflers, mantillas, veils, etc, of wool",2021,01,"Number of item",09,"Kilogram",
62142020,"Shawls, scarves, mufflers, mantillas, veils, etc, of cashmere",2021,01,"Number of item",09,"Kilogram",
62142090,"Shawls, scarves, mufflers, mantillas, veils, etc, of fine animal hair(excl.cashmere)",2021,01,"Number of item",09,"Kilogram",
62143000,"Shawls, scarves, mufflers, mantillas, veils, etc, of synthetic fibr",2021,01,"Number of item",09,"Kilogram",
62144000,"Shawls, scarves, mufflers, mantillas, veils, etc, of artificial fib",2021,01,"Number of item",09,"Kilogram",
62149000,"Shawls, scarves, mufflers, mantillas, veils, etc, of oth textls nes",2021,01,"Number of item",09,"Kilogram",
62151000,"Ties, bow ties & cravats of silk or silk waste",2021,01,"Number of item",09,"Kilogram",
62152000,"Ties, bow ties & cravats of man-made fibres",2021,01,"Number of item",09,"Kilogram",
62159000,"Ties, bow ties & cravats of other textiles, nes",2021,01,"Number of item",09,"Kilogram",
62160000,"Gloves, mittens & mitts",2021,02,"Pair",09,"Kilogram",
62171010,"Stocking, socks and sockettes",2021,09,"Kilogram",02,"Pair",
62171020,"Kimono belts",2021,09,"Kilogram",01,"Number of item",
62171090,"Other made up clothing accessories, nes",2021,09,"Kilogram",?,"?",
62179000,"Parts of garments or of clothing accessories, nes",2021,09,"Kilogram",?,"?",
63011000,"Electric blankets",2021,01,"Number of item",09,"Kilogram",
63012000,"Blankets (excl. electric blankets) & travelling rugs, of wool...",2021,01,"Number of item",09,"Kilogram",
63013000,"Blankets (excl. electric blankets) & travelling rugs, of cotton",2021,01,"Number of item",09,"Kilogram",
63014000,"Blankets (excl. electric blankets), etc, of synthetic fibres",2021,01,"Number of item",09,"Kilogram",
63019000,"Other blankets & travelling rugs, nes",2021,01,"Number of item",09,"Kilogram",
63021010,"Bed linen, of cotton, knitted or crocheted",2021,01,"Number of item",09,"Kilogram",
63021090,"Bed linen, of other textiles, knitted or crocheted",2021,01,"Number of item",09,"Kilogram",
63022110,"Printed cotton bed sheets, not knitted or crocheted",2021,01,"Number of item",09,"Kilogram",
63022190,"Other printed cotton bed-linen, not knitted or crocheted",2021,01,"Number of item",09,"Kilogram",
63022210,"Printed bed sheets of man-made fibres, not knitted or crocheted",2021,01,"Number of item",09,"Kilogram",
63022290,"Other printed bed-linen of man-made fibres, not knittd or crochetd",2021,01,"Number of item",09,"Kilogram",
63022910,"Printed bed-linen of silk or silk waste, not knitted or crocheted",2021,01,"Number of item",09,"Kilogram",
63022920,"Printed bed-linen of bast fibres, not knitted or crocheted",2021,01,"Number of item",09,"Kilogram",
63022990,"Printed bed-linen of other textiles, nes, not knittd or crochetd",2021,01,"Number of item",09,"Kilogram",
63023110,"Embroidered cotton bed linen, not knit,crochtd or printed",2021,01,"Number of item",09,"Kilogram",
63023191,"Cotton bed sheets,not knitted, crocheted, printed or embroiderd",2021,01,"Number of item",09,"Kilogram",
63023192,"Cotton towelling coverlets, not knit, crochtd, printd or embroid",2021,01,"Number of item",09,"Kilogram",
63023199,"Other cotton bed linen, not knit, crochetd, printd or embroid, nes",2021,01,"Number of item",09,"Kilogram",
63023210,"Embroiderd bed linen of man-made fibres, not knit,crocht or print",2021,01,"Number of item",09,"Kilogram",
63023290,"Othr bed linen of man-made fibres,not knit, crocht,printd or embroid",2021,01,"Number of item",09,"Kilogram",
63023910,"Bed linen of silk or silk waste, not knit,crochetd or printd, nes",2021,01,"Number of item",09,"Kilogram",
63023921,"Embroiderd bed linen of bast fibres,not knit, crochtd or printd",2021,01,"Number of item",09,"Kilogram",
63023929,"Other bed linen of bast fibres,not knit,crochtd,print or embroid",2021,01,"Number of item",09,"Kilogram",
63023991,"Embroiderd bed linen of other textls,not knit, crocht or print",2021,01,"Number of item",09,"Kilogram",
63023999,"Bed linen of oth textls, not knit,crocht,printd or embroiderd, nes",2021,01,"Number of item",09,"Kilogram",
63024010,"Table linen, handmade, knitted or crocheted",2021,01,"Number of item",09,"Kilogram",
63024090,"Table linen, machine-made, knitted or crocheted",2021,01,"Number of item",09,"Kilogram",
63025110,"Table linen of cotton, embroidered, not knitted or crocheted",2021,01,"Number of item",09,"Kilogram",
63025190,"Table linen of cotton, not embroidered, knitted or crocheted",2021,01,"Number of item",09,"Kilogram",
63025310,"Table linen of man-made fibres, embroidered, not knit or crocheted",2021,01,"Number of item",09,"Kilogram",
63025390,"Table linen of man-made fibres, not embroid, knitted or crocheted",2021,01,"Number of item",09,"Kilogram",
63025911,"Table linen of flax, embroidered, not knitted or crocheted",2021,01,"Number of item",09,"Kilogram",
63025919,"Table linen of flax, not embroidered, knitted or crocheted",2021,01,"Number of item",09,"Kilogram",
63025990,"Table linen of other textiles materials, nes, not knitted or crocheted",2021,01,"Number of item",09,"Kilogram",
63026010,"Bath towels of terry fabrics,of cotton",2021,01,"Number of item",09,"Kilogram",
63026090,"Other toilet linen & kitchen linen of terry fabrics,of cotton",2021,01,"Number of item",09,"Kilogram",
63029100,"Toilet linen & kitchen linen, of cotton, nes",2021,01,"Number of item",09,"Kilogram",
63029300,"Toilet linen & kitchen linen, of man-made fibres, nes",2021,01,"Number of item",09,"Kilogram",
63029910,"Toilet linen & kitchen linen, of flax, nes",2021,01,"Number of item",09,"Kilogram",
63029990,"Toilet linen & kitchen linen, of other textiles, nes",2021,01,"Number of item",09,"Kilogram",
63031210,"Curtains & interior blinds; valances of synthetic fibres, knitted",2021,09,"Kilogram",?,"?",
63031220,"Curtains & interior blinds; valances of synthetic fibres, crocheted",2021,09,"Kilogram",?,"?",
63031931,"Curtains & interior blinds; valances of cotton, knitted",2021,09,"Kilogram",?,"?",
63031932,"Curtains & interior blinds; valances of cotton, crocheted",2021,09,"Kilogram",?,"?",
63031991,"Curtains & interior blinds; valances of other textiles, knitted",2021,09,"Kilogram",?,"?",
63031992,"Curtains & interior blinds; valances of other textiles, crocheted",2021,09,"Kilogram",?,"?",
63039100,"Curtains & interior blinds; valances of cotton, not knit or crochtd",2021,09,"Kilogram",?,"?",
63039200,"Curtains & interior blinds; valances of synthc fibres, not knit or crochtd",2021,09,"Kilogram",?,"?",
63039900,"Curtains & interior blinds; valances of oth textiles, not knit or crochtd",2021,09,"Kilogram",?,"?",
63041121,"Bedspreads, hand - knitted",2021,01,"Number of item",09,"Kilogram",
63041129,"Bedspreads, machine - knitted",2021,01,"Number of item",09,"Kilogram",
63041131,"Bedspreads, hand- crocheted",2021,01,"Number of item",09,"Kilogram",
63041139,"Bedspreads, machine-crocheted",2021,01,"Number of item",09,"Kilogram",
63041910,"Bedspreads of silk or silk waste, not knitted or crocheted",2021,01,"Number of item",09,"Kilogram",
63041921,"Embroiderd bedspreads of cotton or bast fibres, not knit or crochetd",2021,01,"Number of item",09,"Kilogram",
63041929,"Nonembroid bedspreads of cotton or bast fibs, not knitd or crocheted",2021,01,"Number of item",09,"Kilogram",
63041931,"Embroiderd bedspreads of man-made fibres,not knitted or crocheted",2021,01,"Number of item",09,"Kilogram",
63041939,"Nonembroid bedspreads of man-made fibres, not knitted or crocheted",2021,01,"Number of item",09,"Kilogram",
63041991,"Embroiderd bedspreads of other textls nes,not knitted or crocheted",2021,01,"Number of item",09,"Kilogram",
63041999,"Nonembroid bedspreads of other textls nes, not knitted or crocheted",2021,01,"Number of item",09,"Kilogram",
63042010,"Hand-worked mosquito net of warp knit fabrics specified in Subheading Note 1 to Chapter 63",2021,01,"Number of item",09,"Kilogram",
63042090,"Non-hand-worked mosquito net of warp knit fabrics specified in Subheading Note 1 to Chapter 63",2021,01,"Number of item",09,"Kilogram",
63049121,"Furnishing articles, nes, hand - knitted",2021,09,"Kilogram",?,"?",
63049129,"Furnishing articles, nes, machine - knitted",2021,09,"Kilogram",?,"?",
