"CODES","DESCRIPTION","YEAR","UNIT_1_CODES","UNIT_1_DESCRIPTION","UNIT_2_CODES","UNIT_2_DESCRIPTION",
35011000,"Casein",2021,09,"Kilogram",?,"?",
35019000,"Caseinates&other casein derivatives; casein glues",2021,09,"Kilogram",?,"?",
35021100,"Egg albumin, dried",2021,09,"Kilogram",?,"?",
35021900,"Egg albumin other than dried",2021,09,"Kilogram",?,"?",
35022000,"Milk albumin",2021,09,"Kilogram",?,"?",
35029000,"Albumins, albuminates&other dreivatives, nes",2021,09,"Kilogram",?,"?",
35030010,"Gelatin&derivatives",2021,09,"Kilogram",?,"?",
35030090,"Isinglass; other glues of animal origin",2021,09,"Kilogram",?,"?",
35040010,"Peptones&derivatives",2021,09,"Kilogram",?,"?",
35040090,"Protein substances&derivatives, nes; hide powder",2021,09,"Kilogram",?,"?",
35051000,"Dextrins&other modified starches",2021,09,"Kilogram",?,"?",
35052000,"Glues based on starches, dextrins or other modified starches",2021,09,"Kilogram",?,"?",
35061000,"Products put up as glues or adhesives for retail sale wt.¡Ü1kg",2021,09,"Kilogram",?,"?",
35069110,"Adhesives based on polyamide",2021,09,"Kilogram",?,"?",
35069120,"Adhesives based on epoxy resin",2021,09,"Kilogram",?,"?",
35069190,"Adhesives based on rubber or plastic, nes",2021,09,"Kilogram",?,"?",
35069900,"Prepared glues&other prepared adhesives, nes",2021,09,"Kilogram",?,"?",
35071000,"Rennet&concentrates thereof",2021,09,"Kilogram",?,"?",
35079010,"Basic proteinase",2021,09,"Kilogram",?,"?",
35079020,"Basic lipase",2021,09,"Kilogram",?,"?",
35079090,"Other Enzymes; prepared enzymes, nes",2021,09,"Kilogram",?,"?",
36010000,"Propellent powders",2021,09,"Kilogram",?,"?",
36020010,"Ammonium nitrate explosives",2021,09,"Kilogram",?,"?",
36020090,"Prepared explosives (excl. propellent powders), nes",2021,09,"Kilogram",?,"?",
36030000,"Safety&detonating fuses; percussion caps; igniters; electric detonators",2021,09,"Kilogram",?,"?",
36041000,"Fireworks",2021,09,"Kilogram",?,"?",
36049000,"Signalling flares, rain rockets, fog signaols& other pyrotechnic articles",2021,09,"Kilogram",?,"?",
36050000,"Matches (excl. pyrotechnic articles of 36.04)",2021,09,"Kilogram",?,"?",
36061000,"Liquid or liquefied-gas fuels in container¡Ü300cm3, for lighters,",2021,09,"Kilogram",?,"?",
36069011,"Ferro-cerium&pyrophoric alloys, cut to shape for immediate use",2021,09,"Kilogram",?,"?",
36069019,"Ferro-cerium&pyrophoric alloys, not cut to shape for immediate use",2021,09,"Kilogram",?,"?",
36069090,"Other articles of combustible materials, nes",2021,09,"Kilogram",?,"?",
37011000,"Photographic plates&flat film , for X-ray, sensitized, unexposed",2021,09,"Kilogram",05,"Square Metre",
37012000,"Instant print flat film, unexposed",2021,09,"Kilogram",?,"?",
37013021,"Laser phototypesetting film, unexposed, any side£¾255mm",2021,09,"Kilogram",05,"Square Metre",
37013022,"Precoated sensitized plate, unexposed, any side£¾255mm",2021,09,"Kilogram",05,"Square Metre",
37013024,"CTP plate,unexposed, any side£¾255mm",2021,09,"Kilogram",05,"Square Metre",
37013025,"Flexographic printing plates",2021,09,"Kilogram",05,"Square Metre",
37013029,"Othr photo plates&film, unexposed, any side£¾255mm, for printing plates,",2021,09,"Kilogram",05,"Square Metre",
37013090,"Photo plates&film, unexposed, any side£¾255mm, nes",2021,09,"Kilogram",05,"Square Metre",
37019100,"Colour photo plates&flat film, unexposed",2021,09,"Kilogram",?,"?",
37019920,"Photographic plates&flat film , unexposed, for printing plates/cylinders",2021,09,"Kilogram",05,"Square Metre",
37019990,"Photographic plates&flat film, unexposed, nes",2021,09,"Kilogram",05,"Square Metre",
37021000,"Photographic film in rolls, for X-ray, unexposed",2021,09,"Kilogram",05,"Square Metre",
37023110,"Instant print color photo film in rolls, unexpsd,unperforated,w.¡Ü105mm",2021,09,"Number of item",05,"Square Metre",
37023190,"Colour photo film rolls,unexpsd,unperforated,w¡Ü105mm,nes",2021,09,"Number of item",05,"Square Metre",
37023210,"Instant print film rolls, unexpsd, unperforated, slvr hal. emul., w.¡Ü105mm",2021,09,"Kilogram",05,"Square Metre",
37023220,"Printing plate film rolls,unexpsd, unperforated, slvr hal. emul., w.¡Ü105mm",2021,09,"Kilogram",05,"Square Metre",
37023290,"Photo film rolls,unexpsd, unperforated, slvr hal. emul., w.¡Ü105mm, nes",2021,09,"Kilogram",05,"Square Metre",
37023920,"Printing plate film rolls,unexpsd, unperforated,, w.¡Ü105mm, nes",2021,09,"Kilogram",05,"Square Metre",
37023990,"Othr photo film rolls, unexpsd, unperforated, w.¡Ü105mm, nes",2021,09,"Kilogram",05,"Square Metre",
37024100,"Colour film rolls, unexpsd, unperforated, w.£¾610mm, l.£¾200m",2021,09,"Kilogram",05,"Square Metre",
37024221,"W. anticorrosive plate for prntd circuit processing, w.£¾610mm, l.£¾200m",2021,09,"Kilogram",05,"Square Metre",
37024229,"Printing plate flm rolls,un-expsd/prfrtd,not color,w.£¾610mm,l.£¾200m,nes",2021,09,"Kilogram",05,"Square Metre",
37024292,"Red or infra-red laser film, unexposed w.£¾610mm, l.£¾200m",2021,09,"Kilogram",05,"Square Metre",
37024299,"Photo film rolls, unexpsd, unperforated, not color, w.£¾610mm, l.£¾200m,nes",2021,09,"Kilogram",05,"Square Metre",
37024321,"Laser phototypesetting film, unexpsd, unperforated,, w.£¾610mm, l.¡Ü200m",2021,09,"Kilogram",05,"Square Metre",
37024329,"Printing plate flm rolls,, unexpsd, unperforated,, w.£¾610mm, l.¡Ü200m,nes",2021,09,"Kilogram",05,"Square Metre",
37024390,"Othr photo film rolls, unexpsd, unperforated, w.£¾610mm, l.¡Ü200m ,nes",2021,09,"Kilogram",05,"Square Metre",
37024421,"Laser phototypesetting film, unexpsd, unperforated, 105mm£¼w.¡Ü610mm",2021,09,"Kilogram",05,"Square Metre",
37024422,"Narrow anticorrosive plate for prntd circuit processing, 105£¼w.¡Ü610 mm",2021,09,"Kilogram",05,"Square Metre",
37024429,"Printing plate flm rolls, unexpsd, unperforated, 105mm£¼w.¡Ü610mm",2021,09,"Kilogram",05,"Square Metre",
37024490,"Photo film rolls, unexpsd, unperforated, 105mm£¼w.¡Ü610mm, nes",2021,09,"Kilogram",05,"Square Metre",
37025200,"Colour films rolls, unexpsd, w.£¼mm",2021,09,"Metre",05,"Square Metre",
37025300,"Colour slide film rolls,unexpsd, 16mm£¼w.¡Ü35mm, l.¡Ü30m",2021,09,"Metre",05,"Square Metre",
37025410,"Colour film rolls,unexpsd, width=35mm, length¡Ü2m, not for slides",2021,09,"Metre",05,"Square Metre",
37025490,"Colour film rolls, unexpsd,16mm£¼w.¡Ü35mm, l.¡Ü30m, not for slides, nes",2021,09,"Metre",05,"Square Metre",
37025520,"Colour cinema film rolls,unexpsd, 16mm£¼w.¡Ü35mm, l.£¾30m",2021,09,"Metre",05,"Square Metre",
37025590,"Colour film rolls,unexpsd, 16mm£¼w.¡Ü35mm, l.£¾30m, nes",2021,09,"Metre",05,"Square Metre",
37025620,"Colour cinema film rolls, unexpsd, width£¾35mm",2021,09,"Metre",05,"Square Metre",
37025690,"Colour film in rolls, unexposed, width£¾35mm, nes",2021,09,"Metre",05,"Square Metre",
37029600,"Other rolls, unexposed, w.¡Ü35mm, l.¡Ü30m,",2021,09,"Metre",05,"Square Metre",
37029700,"Other rolls, unexposed, w.¡Ü35mm, l.£¾30m,",2021,09,"Metre",05,"Square Metre",
37029800,"Other rolls, unexposed,  width£¾35mm",2021,09,"Metre",05,"Square Metre",
37031010,"Photo paper&paperboard in rolls, unexposed, width£¾610mm",2021,09,"Kilogram",?,"?",
37031090,"Photographic textiles in rolls,unexposed, width£¾610mm",2021,09,"Kilogram",?,"?",
37032010,"Other colour photo paper and paperboard, unexposed",2021,09,"Kilogram",?,"?",
37032090,"Other colour photographic textiles, unexposed",2021,09,"Kilogram",?,"?",
37039010,"Other photographic paper&paperboard, unexposed",2021,09,"Kilogram",?,"?",
37039090,"Other photographic textiles,unexposed",2021,09,"Kilogram",?,"?",
37040010,"Cinematograph film, exposed but not developed",2021,09,"Kilogram",?,"?",
37040090,"Photo plates/film/paper/paperboard/textiles, exposed, not developed, nes",2021,09,"Kilogram",?,"?",
37050010,"Lantern slides, exposed/developed, for educational use only",2021,09,"Kilogram",?,"?",
37050021,"Exposed/developed microfilms, for printed books and newspapers",2021,09,"Kilogram",?,"?",
37050029,"Other exposed/developed microfilms",2021,09,"Kilogram",?,"?",
37050090,"Other exposed/developed photo plates/films, excl. cinema film",2021,09,"Kilogram",?,"?",
37061010,"Cinema film, exposed&developed, width¡Ý35mm, for educational use",2021,09,"Kilogram",04,"Metre",
37061090,"Other cinema film, exposed&developed, width¡Ý35mm",2021,09,"Kilogram",04,"Metre",
37069010,"Cinema film, exposed&developed, width£¼35mm, for educational use",2021,09,"Kilogram",04,"Metre",
37069090,"Other cinema film, exposed&developed, width£¼35mm",2021,09,"Kilogram",04,"Metre",
37071000,"Sensitising emulsions for photographic uses",2021,09,"Kilogram",?,"?",
37079010,"Chemical prep. for developing photo film/paper",2021,09,"Kilogram",?,"?",
37079020,"Chemical prep. for photo-copying machines",2021,09,"Kilogram",?,"?",
37079090,"Other chemical prep.&unmixed prdcts(ready for use) for photograph, nes",2021,09,"Kilogram",?,"?",
38011000,"Artificial graphite",2021,09,"Kilogram",?,"?",
38012000,"Colloidal graphite or semi-colloidal graphite",2021,09,"Kilogram",?,"?",
38013000,"Carbonaceous pastes for electrodes&pastes for furnace linings",2021,09,"Kilogram",?,"?",
38019010,"Spheroidized graphite by surface treatment",2021,09,"Kilogram",?,"?",
38019090,"Preparations of graphite or carbon in form of semimanufactures nes",2021,09,"Kilogram",?,"?",
38021010,"Wood-based activated carbon",2021,09,"Kilogram",?,"?",
38021090,"Other activated carbon",2021,09,"Kilogram",?,"?",
38029000,"Activated natural mineral prod.s; animal black",2021,09,"Kilogram",?,"?",
38030000,"Tall oil, whether or not refined",2021,09,"Kilogram",?,"?",
38040000,"Residual lyes from the manufacture of wood pulp (excl. tall oil)",2021,09,"Kilogram",?,"?",
38051000,"Gum, wood or sulphate turpentine oils",2021,09,"Kilogram",?,"?",
38059010,"Pine oil containing alpha-terpined as the main constituent",2021,09,"Kilogram",?,"?",
38059090,"Other turpenic oils; crude dipentene; sulphite turpentine; crude paracymene",2021,09,"Kilogram",?,"?",
38061010,"Rosin",2021,09,"Kilogram",?,"?",
38061020,"Resin acids",2021,09,"Kilogram",?,"?",
38062010,"Salts of rosin or of resin acids",2021,09,"Kilogram",?,"?",
38062090,"Salts of derivatives of rosin or resin acids",2021,09,"Kilogram",?,"?",
38063000,"Ester gums",2021,09,"Kilogram",?,"?",
38069000,"Derivatives of rosin&resin acids, nes; rosin spirit&oils, nes",2021,09,"Kilogram",?,"?",
38070000,"Wood tar&its oils; wood creosote&naphtha; vegetable&brewers¡¯s pitch.",2021,09,"Kilogram",?,"?",
38085200,"DDT (ISO) (clofenotane (INN)), in packings of net weight¡Ü300g",2021,09,"Kilogram",?,"?",
38085910,"Other goods specified in Subheading Note 1 of Chapter 38, in retail packaging",2021,09,"Kilogram",?,"?",
38085990,"Other goods specified in Subheading Note 1 of Chapter 38, not in retail packaging",2021,09,"Kilogram",?,"?",
38086100,"Goods specified in Subheading Note 2 of Chapter 38, in packings of net weight¡Ü300g",2021,09,"Kilogram",?,"?",
38086200,"Goods specified in Subheading Note 2 of Chapter 38, in packings of 300g£¼net weight¡Ü7.5kg",2021,09,"Kilogram",?,"?",
38086900,"Goods specified in Subheading Note 2 of Chapter 38, in packings of net weight£¾7.5kg",2021,09,"Kilogram",?,"?",
38089111,"Mosquito smudges in retail packagings",2021,09,"Kilogram",?,"?",
38089112,"Biopesticide in retail packagings",2021,09,"Kilogram",?,"?",
38089119,"Other insecticides in retail packagings",2021,09,"Kilogram",?,"?",
38089190,"Insecticides, not in retail packagings",2021,09,"Kilogram",?,"?",
38089210,"Fungicides in retail packagings",2021,09,"Kilogram",?,"?",
38089290,"Fungicides, not in retail packagings",2021,09,"Kilogram",?,"?",
38089311,"Herbicides, in retail packagings",2021,09,"Kilogram",?,"?",
38089319,"Herbicides, not in retail packagings",2021,09,"Kilogram",?,"?",
38089391,"Anti-sproutng prod/plant growth regulators, in retail packagings",2021,09,"Kilogram",?,"?",
38089399,"Anti-sproutng prod/plant growth regulators, not in retail packagings",2021,09,"Kilogram",?,"?",
38089400,"Disinfectants,nes",2021,09,"Kilogram",?,"?",
38089910,"Rodenticides similar prdct, in retail packagings",2021,09,"Kilogram",?,"?",
38089990,"Rodenticides&similar prdct, not in retail packagings",2021,09,"Kilogram",?,"?",
38091000,"Finishing agents,dye carriers&othr prdct&prep., with amylaceous basis",2021,09,"Kilogram",?,"?",
38099100,"Finishing agents,dye carriers&othr prdct&prep., used in textile industry",2021,09,"Kilogram",?,"?",
38099200,"Finishing agents,dye carriers&othr prdct&prep., used in paper industry",2021,09,"Kilogram",?,"?",
38099300,"Finishing agents,dye carriers&othr prdct&prep., used in leather industry",2021,09,"Kilogram",?,"?",
38101000,"Pickling prep. for metal surfaces;soldering/brazing/welding powder&pastes",2021,09,"Kilogram",?,"?",
38109000,"Prep. such as fluxes for soldering /brazing/welding, nes",2021,09,"Kilogram",?,"?",
38111100,"Anti-knock prep. based on lead compounds",2021,09,"Kilogram",?,"?",
38111900,"Anti-knock prep. (excl. based on lead)",2021,09,"Kilogram",?,"?",
38112100,"Additives for lubricating oils with petroleum oils",2021,09,"Kilogram",?,"?",
38112900,"Additives for lubricating oils (excl. with petroleum oils)",2021,09,"Kilogram",?,"?",
38119000,"oxidation inhibitors&othr additives, nes, for mineral oils/same purpose oils",2021,09,"Kilogram",?,"?",
38121000,"Prepared rubber accelerators",2021,09,"Kilogram",?,"?",
38122000,"Compound plasticisers for rubber or plastics, nes",2021,09,"Kilogram",?,"?",
38123100,"Mixtures of oligomers of 2,2,4-trimethyl-1,2-dihydroquinoline (TMQ)",2021,09,"Kilogram",?,"?",
38123910,"Other rubber antioxidants",2021,09,"Kilogram",?,"?",
38123990,"Anti-oxidizing preparations and other compound stabilizers for rubber/plastics, nes",2021,09,"Kilogram",?,"?",
38130010,"Preparations and charges for fire-extinguishers",2021,09,"Kilogram",?,"?",
38130020,"Charged fire-extinguishing grenades",2021,09,"Kilogram",?,"?",
38140000,"Organic composite solvents&thinners, nes; paint or varnish removers",2021,09,"Kilogram",?,"?",
38151100,"Supported catalysts with nickel or its compounds",2021,09,"Kilogram",?,"?",
38151200,"Supported catalysts with precious metal or its compounds",2021,09,"Kilogram",?,"?",
38151900,"Supported catalysts, nes",2021,09,"Kilogram",?,"?",
38159000,"Reaction initiators, accelerators&catalytic prep., nes",2021,09,"Kilogram",?,"?",
38160000,"Refractory cements, mortars, concretes&similar compositions, nes",2021,09,"Kilogram",?,"?",
38170000,"Mixed alkylbenzenes and alkylnaphthalenes, nes",2021,09,"Kilogram",?,"?",
38180011,"Monocrysta silicon disk/wafer, 7.5cm¡Üd.¡Ü15.24cm, doped for electronics",2021,09,"Kilogram",01,"Number of item",
38180019,"Monocrystal silicon disk/wafer, d.£¾15.24cm, doped for electronics",2021,09,"Kilogram",01,"Number of item",
38180090,"Chemical elements disk/wafer&compounds, doped for lectronics, nes",2021,09,"Kilogram",?,"?",
38190000,"Hydraulic brake fluids&similar liquids with£¼70% petroleum oil",2021,09,"Kilogram",?,"?",
38200000,"Anti-freezing prep.&prepared de-icing fluids",2021,09,"Kilogram",?,"?",
38210000,"Prepared culture media for micro-organisms,plant,human or animal cells",2021,09,"Kilogram",?,"?",
38220010,"Diagnostic or laboratory reagents on a backing",2021,09,"Kilogram",?,"?",
38220090,"Prepared diagnostic or laboratory reagents, nes£»certified reference materials",2021,09,"Kilogram",?,"?",
38231100,"Industrial stearic acid",2021,09,"Kilogram",?,"?",
38231200,"Industrial oleic acid",2021,09,"Kilogram",?,"?",
38231300,"Industrial tall oil fatty acids",2021,09,"Kilogram",?,"?",
38231900,"Industrial monocarboxylic fatty acids;acid oils from refinng, nes",2021,09,"Kilogram",?,"?",
38237000,"Industrial fatty alcohols",2021,09,"Kilogram",?,"?",
38241000,"Prepared binders for foundry moulds or cores",2021,09,"Kilogram",?,"?",
38243000,"Non-agglomeratd metal carbides mixd together or with metllic binders",2021,09,"Kilogram",?,"?",
38244010,"High performance water-reducing agent",2021,09,"Kilogram",?,"?",
38244090,"Other prepared additives for cements, mortars or concretes",2021,09,"Kilogram",?,"?",
38245000,"Non-refractory mortars&concretes",2021,09,"Kilogram",?,"?",
38246000,"Sorbitol (excl. that of 2905.44)",2021,09,"Kilogram",?,"?",
38247100,"Mixtures containing chlorofluorocarbons of meth-,eth- or prop-ane",2021,09,"Kilogram",?,"?",
38247200,"Mixtures containing bromochlorodifluoromethane,etc.",2021,09,"Kilogram",?,"?",
38247300,"Mixtures containing HBFCs of meth-,eth- or prop-ane",2021,09,"Kilogram",?,"?",
38247400,"Mixtures containing HCFCs of meth-,eth- or prop-ane",2021,09,"Kilogram",?,"?",
38247500,"Mixtures containing carbon tetrachloride",2021,09,"Kilogram",?,"?",
38247600,"Mixtures containing methyl chloroform",2021,09,"Kilogram",?,"?",
38247700,"Mixtures containing bromo- or bromo-chloro methane",2021,09,"Kilogram",?,"?",
38247800,"Mixtures containing PFCs or HFCs, not CFCs or HCFCs",2021,09,"Kilogram",?,"?",
38247900,"Mixtures containing halogenated derive. of meth-,eth- or prop-ane,nes",2021,09,"Kilogram",?,"?",
38248100,"Mixtures containing oxirane",2021,09,"Kilogram",?,"?",
38248200,"Mixtures containing PCBs,PCTs or PBBs",2021,09,"Kilogram",?,"?",
38248300,"Mixtures containing tris(2,3-dibromopropyl) phosphate",2021,09,"Kilogram",?,"?",
38248400,"Mixtures containing aldrin(ISO)/camphechlor(ISO)/chlordane(ISO)/chlordecone(ISO)/DDT(ISO) etc.",2021,09,"Kilogram",?,"?",
38248500,"Mixtures containing 1,2,3,4,5,6-hexachlorocyclohexane (HCH (ISO)), including lindane (ISO, INN)",2021,09,"Kilogram",?,"?",
38248600,"Mixtures containing pentachlorobenzene (ISO) or hexachlorobenzene (ISO)",2021,09,"Kilogram",?,"?",
38248700,"Mixtures containing perfluorooctane sulphonic acid/salts, perfluorooctane sulphonamides/perfluorooctane sulphonyl fluoride",2021,09,"Kilogram",?,"?",
38248800,"Mixtures containing tetra-, penta-, hexa- hepta- or octabromodiphenyl ethers",2021,09,"Kilogram",?,"?",
38249100,"Mixtures consisting mainly of (5-ethyl-2-methyl-2-oxido-1,3,2-dioxaphosphinan-5-yl)methyl methyl methylphosphonate and bis[(5-ethyl-2-methyl-2-oxido-1,3,2-dioxaphosphinan-5-yl)methyl] methylphosphonate",2021,09,"Kilogram",?,"?",
38249910,"Fusel oil",2021,09,"Kilogram",?,"?",
38249920,"Ink-removers, stencil correctors and the like",2021,09,"Kilogram",?,"?",
38249930,"Carburetant",2021,09,"Kilogram",?,"?",
38249991,"Mixtures containing talc£¾50% by weight",2021,09,"Kilogram",?,"?",
38249992,"Mixtures containing magnesium oxide£¾70% by weight",2021,09,"Kilogram",?,"?",
38249993,"Nickelous hydroxide(doped carbon) covered on the face side with cobalt compound",2021,09,"Kilogram",?,"?",
38249999,"Chemical products and preparations of the chemical or allied industries, nes",2021,09,"Kilogram",?,"?",
38251000,"Municipal waste",2021,09,"Kilogram",?,"?",
38252000,"Sewage sludge",2021,09,"Kilogram",?,"?",
38253000,"Clinical waste",2021,09,"Kilogram",?,"?",
38254100,"Wasted organic halogenated solvents",2021,09,"Kilogram",?,"?",
38254900,"Waste organic solvents, nes",2021,09,"Kilogram",?,"?",
38255000,"Wastes of metal pickling liguors, hydraulic fluids, brake fluids",2021,09,"Kilogram",?,"?",
38256100,"Wastes from chemical or allied industries containing organic constituents",2021,09,"Kilogram",?,"?",
38256900,"Other wastes from chemical or allied industries",2021,09,"Kilogram",?,"?",
38259000,"Residual products of the chemical or allied industries, nes",2021,09,"Kilogram",?,"?",
38260000,"Biodiesel and mixtures thereof, without or with petroleum oils£¼70% by weight",2021,09,"Kilogram",07,"Litre",
39011000,"Polyethylene having a specific gravity£¼0.94, in primary forms",2021,09,"Kilogram",?,"?",
39012000,"Polyethylene having a specific gravity¡Ý0.94, in primary forms",2021,09,"Kilogram",?,"?",
39013000,"Ethylene-vinyl acetate copolymers, in primary forms",2021,09,"Kilogram",?,"?",
39014010,"Ethylene-propylene copolymers having a specific gravity£¼0.94, in primary forms",2021,09,"Kilogram",?,"?",
39014020,"Linearity low density polyethylene having a specific gravity£¼0.94, in primary forms",2021,09,"Kilogram",?,"?",
39014090,"Other ethylene-alpha-olefin copolymers having a specific gravity£¼0.94, in primary forms",2021,09,"Kilogram",?,"?",
39019010,"Ethylene-vinyl acetate copolymers, in primary forms, nes",2021,09,"Kilogram",?,"?",
39019090,"Other ethylene-vinyl copolymers, in primary forms, nes",2021,09,"Kilogram",?,"?",
39021000,"Polypropylene, in primary forms",2021,09,"Kilogram",?,"?",
39022000,"Polyisobutylene, in primary forms",2021,09,"Kilogram",?,"?",
39023010,"Ethylene-propylene copolymers, in primary forms",2021,09,"Kilogram",?,"?",
39023090,"Other ethylene-propylene copolymers, in primary forms, nes",2021,09,"Kilogram",?,"?",
39029000,"Other polymers of propylene or other olefins, in primary forms, nes",2021,09,"Kilogram",?,"?",
39031100,"Expansible polystyrene, in primary forms",2021,09,"Kilogram",?,"?",
39031910,"Modified polystyrene (excl.expansible), in primary forms",2021,09,"Kilogram",?,"?",
39031990,"Other polystyrene (excl.expansible), in primary forms",2021,09,"Kilogram",?,"?",
39032000,"Styrene-acrylonitrile (SAN) copolymers, in primary forms",2021,09,"Kilogram",?,"?",
39033010,"Modified acrylonitrile-butadiene-styrene(ABS) copolymers,in primary form",2021,09,"Kilogram",?,"?",
39033090,"Other acrylonitrile-butadiene-styrene(ABS) copolymers,in primary form",2021,09,"Kilogram",?,"?",
39039000,"Polymers of styrene, in primary forms, nes",2021,09,"Kilogram",?,"?",
39041010,"Paste resins",2021,09,"Kilogram",?,"?",
39041090,"Other poly, not mixed with any other substances",2021,09,"Kilogram",?,"?",
39042100,"Non-plasticised polyvinyl chloride mixed, in primary forms",2021,09,"Kilogram",?,"?",
39042200,"Plasticised polyvinyl chloride mixed, in primary forms",2021,09,"Kilogram",?,"?",
39043000,"Vinyl chloride-vinyl acetate copolymers, in primary forms",2021,09,"Kilogram",?,"?",
39044000,"Vinyl chloride copolymers (excl. acetate), in primary forms",2021,09,"Kilogram",?,"?",
39045000,"Vinylidene chloride polymers, in primary forms",2021,09,"Kilogram",?,"?",
39046100,"Polytetrafluoroethylene, in primary forms",2021,09,"Kilogram",?,"?",
39046900,"Fluoro-polymers (excl. polytetrafluoroethylene), in primary forms",2021,09,"Kilogram",?,"?",
39049000,"Polymers of halogenated olefins, in primary forms, nes",2021,09,"Kilogram",?,"?",
39051200,"Polyvinyl acetate, in aqueous dispersion",2021,09,"Kilogram",?,"?",
39051900,"Polyvinyl acetate, in other primary forms, nes",2021,09,"Kilogram",?,"?",
39052100,"Vinyl acetate copylymers, in aqueous dispersion",2021,09,"Kilogram",?,"?",
39052900,"Vinyl acetate copylymers, in other primary forms, nes",2021,09,"Kilogram",?,"?",
39053000,"Polyvinyl alcohols, in primary forms",2021,09,"Kilogram",?,"?",
39059100,"Copolymers of vinyl esters/polymers, nes, in primary forms",2021,09,"Kilogram",?,"?",
39059900,"Vinyl/vinyl esters polymers, nes, in primary forms",2021,09,"Kilogram",?,"?",
39061000,"Polymethyl methacrylate, in primary forms",2021,09,"Kilogram",?,"?",
39069010,"Polyacrylamide prepared,in primary forms",2021,09,"Kilogram",?,"?",
39069020,"Acrylic acid-acrylic acid sodium cross-linked copolymer,in primary forms",2021,09,"Kilogram",?,"?",
39069090,"Acrylic polymers prepared,in primary forms, nes",2021,09,"Kilogram",?,"?",
39071010,"Polyxymethylene inprimary forms",2021,09,"Kilogram",?,"?",
39071090,"Other polyacetals, in primary forms",2021,09,"Kilogram",?,"?",
39072010,"Polytetramethylene ether glycol(PTMEG) in primary forms",2021,09,"Kilogram",?,"?",
39072090,"Other polyethers in primary forms",2021,09,"Kilogram",?,"?",
39073000,"Epoxide resins, in primary forms",2021,09,"Kilogram",?,"?",
39074000,"Polycarbonates, in primary forms",2021,09,"Kilogram",?,"?",
39075000,"Alkyd resins, in primary forms",2021,09,"Kilogram",?,"?",
39076110,"Slices/chips of poly(ethylene terephthalate), viscosity number¡Ý78 ml/g",2021,09,"Kilogram",?,"?",
39076190,"Other poly(ethylene terephthalate) in primary forms, viscosity number¡Ý78 ml/g",2021,09,"Kilogram",?,"?",
39076910,"Slices/chips of poly(ethylene terephthalate), viscosity number£¼78 ml/g",2021,09,"Kilogram",?,"?",
39076990,"Other poly(ethylene terephthalate) in primary forms, viscosity number£¼78 ml/g",2021,09,"Kilogram",?,"?",
39077000,"Poly(lactic acid), in primary forms",2021,09,"Kilogram",?,"?",
39079100,"Unsaturated polyesters, in primary forms, nes",2021,09,"Kilogram",?,"?",
39079910,"Polybutylene terephthalate(PBT), in primary forms",2021,09,"Kilogram",?,"?",
39079991,"Poly(terephthalic acid-hexanediol-butanediol ester)",2021,09,"Kilogram",?,"?",
39079999,"Polyesters, in primary forms, nes",2021,09,"Kilogram",?,"?",
39081011,"Slices/chips of polyamide-6,6",2021,09,"Kilogram",?,"?",
39081012,"Slices/chips of polyamide-6",2021,09,"Kilogram",?,"?",
39081019,"Polyamide-11,-12,-6,9,-6,10 or -6,12,slices/chips",2021,09,"Kilogram",?,"?",
39081090,"Other primary polyamide -6, -11, -12, -6,6, -6,9, -6,10 or -6,12",2021,09,"Kilogram",?,"?",
39089010,"Aromatic polyamides and copolymers thereof in primary forms",2021,09,"Kilogram",?,"?",
39089020,"Semi-aromatic polyamides and copolymers thereof in primary forms",2021,09,"Kilogram",?,"?",
39089090,"Polymides in primary forms, nes",2021,09,"Kilogram",?,"?",
39091000,"Urea resins; thiourea resins, in primary forms",2021,09,"Kilogram",?,"?",
39092000,"Melamine resins, in primary forms",2021,09,"Kilogram",?,"?",
39093100,"Poly(methylene phenyl isocyanate) (crude MDI, polymeric MDI), in primary forms",2021,09,"Kilogram",?,"?",
39093900,"Other amino-resins, in primary forms",2021,09,"Kilogram",?,"?",
39094000,"Phenolic resins, in primary forms",2021,09,"Kilogram",?,"?",
39095000,"Polyurethanes, in primary forms",2021,09,"Kilogram",?,"?",
39100000,"Silicones in primary forms",2021,09,"Kilogram",?,"?",
